{
  "$schema":"https://json-schema.org/draft/2020-12/schema","$id":"https://schemas.infinium.dev/json-schema/source-claim-execution-input.v1.schema.json","title":"infinium.llm.source-claim-execution-input/v1","type":"object","additionalProperties":false,
  "required":["schema_id","schema_version","package_id","acquisition_run_id","operation_id","host_authorization_id","owner_kind","owner_id","parent_analysis_run_id","application_scope_id","cost_attribution_scope_id","source_revision_id","declared_purpose","prompt_id","prompt_fingerprint","passages"],
  "properties":{"schema_id":{"const":"infinium.llm.source-claim-execution-input/v1"},"schema_version":{"const":"1"},"package_id":{"$ref":"common.v1.schema.json#/$defs/identifier"},"acquisition_run_id":{"$ref":"common.v1.schema.json#/$defs/identifier"},"operation_id":{"$ref":"common.v1.schema.json#/$defs/identifier"},"host_authorization_id":{"$ref":"common.v1.schema.json#/$defs/identifier"},"owner_kind":{"const":"evidence-acquisition-run"},"owner_id":{"$ref":"common.v1.schema.json#/$defs/identifier"},"parent_analysis_run_id":{"$ref":"common.v1.schema.json#/$defs/identifier"},"application_scope_id":{"$ref":"common.v1.schema.json#/$defs/identifier"},"cost_attribution_scope_id":{"$ref":"common.v1.schema.json#/$defs/identifier"},"source_revision_id":{"$ref":"common.v1.schema.json#/$defs/identifier"},"declared_purpose":{"type":"string","minLength":1,"maxLength":1024},"prompt_id":{"const":"infinium.m1-s6.source-claim-prompt/v1"},"prompt_fingerprint":{"const":"d2915f449e72d43cf697d522f2c6a1b44653dd519daba02968c1bfe3cf66ab84"},"passages":{"type":"array","minItems":1,"maxItems":64,"items":{"$ref":"#/$defs/passage"}}},
  "$defs":{"passage":{"type":"object","additionalProperties":false,"required":["passage_id","source_revision_id","text","text_sha256","deleted"],"properties":{"passage_id":{"$ref":"common.v1.schema.json#/$defs/identifier"},"source_revision_id":{"$ref":"common.v1.schema.json#/$defs/identifier"},"text":{"type":"string","minLength":1,"maxLength":16384},"text_sha256":{"$ref":"common.v1.schema.json#/$defs/fingerprint"},"deleted":{"type":"boolean"}}}}
}
